1,陆帅,男,博士,教授,反问题计算方法与数学理论,复旦大学
2,袁军华,男,博士,教授,细菌运动的物理机制,中国科学技术大学
3,林伟,男,博士,教授,现代生物数学中的方法、理论及在交叉研究中的应用,复旦大学
4,方德清,男,博士,研究员,放射性核束物理,复旦大学
5,王记增,男,博士,教授,固体力学,兰州大学
6,顾为民,男,博士,教授,黑洞吸积与外流,厦门大学
7,向导,男,博士,教授,基于加速器的超快科学装置物理及关键技术,上海交通大学
8,李婧,女,博士,研究员,太赫兹探测，射电天文,中国科学院紫金山天文台
9,邵成刚,男,博士,教授,精密引力实验中的噪声研究,华中科技大学
10,卢海舟,男,博士,教授,磁场中拓扑物质的电子输运理论,南方科技大学
11,刘毅,男,博士,研究员,三维流形的拓扑与几何,北京大学
12,杨振伟,男,博士,副教授,重味强子的实验研究,清华大学
13,杨越,男,博士,研究员,湍流与转捩,北京大学
14,田矗舜,男,博士,研究员,基于量子力学原理的统计物理基础之研究,中国科学院理论物理研究所
15,邹长亮,男,博士,教授,大规模数据统计推断,南开大学
16,孙明波,男,博士,教授,超声速燃烧,中国人民解放军国防科技大学
17,吕朝锋,男,博士,教授,非均质材料与结构力学,浙江大学
18,何峰,男,博士,教授,强场中的原子分子超快动力学研究,上海交通大学
19,王春朋,男,博士,教授,偏微分方程,吉林大学
20,刘睿,男,博士,教授,太阳物理,中国科学技术大学
21,孙麓岩,男,博士,副教授,超导量子计算,清华大学
22,陈树琪,男,博士,教授,少层人工微结构光场调控物理,南开大学
23,姚小虎,男,博士,教授,爆炸与冲击动力学,华南理工大学
24,翁红明,男,博士,研究员,计算凝聚态物理,中国科学院物理研究所
25,王正汹,男,博士,教授,磁约束核聚变等离子体不稳定性,大连理工大学
26,王立峰,男,博士,教授,纳系统动力学,南京航空航天大学
27,潘兵,男,博士,研究员,实验固体力学,北京航空航天大学
28,骆军委,男,博士,研究员,半导体物理与器件物理,中国科学院半导体研究所
29,贾宇,男,博士,研究员,量子色动力学高阶计算及有效场论,中国科学院高能物理研究所
30,李婵颖,女,博士,副研究员,非线性参数系统自适应控制,中国科学院数学与系统科学研究院
31,武海斌,男,博士,教授,超冷量子气体,华东师范大学
32,闫振亚,男,博士,研究员,可积系统与复杂非线性波的数学理论及交叉应用,中国科学院数学与系统科学研究院
33,李整林,男,博士,研究员,深海声学及其应用,中国科学院声学研究所
34,刘劲松,男,博士,研究员,Teichmuller空间以及相关研究,中国科学院数学与系统科学研究院
35,柳振鑫,男,博士,教授,随机动力系统,大连理工大学
36,张本威,男,博士,教授,高能核物理,华中师范大学
37,赵公博,男,博士,研究员,星系巡天宇宙学,中国科学院国家天文台
38,章福祥,男,博士,研究员,光催化全分解水制氢,中国科学院大连化学物理研究所
39,王琳,男,博士,教授,大气污染化学,复旦大学
40,李卫华,男,博士,教授,嵌段共聚物分相纳米结构的分子设计,复旦大学
41,张文彬,男,博士,研究员,精密结构高分子的设计、合成与组装,北京大学
42,王初,男,博士,研究员,化学生物学,北京大学
43,陈晨,男,博士,副教授,纳米催化剂的理性设计和精准调控,清华大学
44,朱听,男,博士,研究员,镜像化学生物学,清华大学
45,张正彪,男,博士,教授,高分子精准合成,苏州大学
46,汤平平,男,博士,研究员,有机氟化学,南开大学
47,车延科,男,博士,研究员,环境分析,中国科学院化学研究所
48,史炳锋,男,博士,教授,有机合成化学,浙江大学
49,赵华章,男,博士,教授,环境化工,北京大学
50,赵达慧,女,博士,教授,有机高分子功能材料化学,北京大学
51,叶树集,男,博士,研究员,复杂体系的界面物理与化学,中国科学技术大学
52,王伟,男,博士,教授,单颗粒化学成像与测量,南京大学
53,贾彦兴,男,博士,研究员,天然产物全合成,北京大学
54,吴长征,男,博士,教授,无机合成化学,中国科学技术大学
55,卢兴,男,博士,教授,金属富勒烯化学,华中科技大学
56,李先锋,男,博士,研究员,液流电池膜材料及应用,中国科学院大连化学物理研究所
57,王铁,男,博士,研究员,疾病体外分析检测,中国科学院化学研究所
58,栾新军,男,博士,教授,有机合成化学,西北大学
59,曾杰,男,博士,教授,金属催化剂表界面配位结构对催化反应的调控机制,中国科学技术大学
60,黄汉民,男,博士,教授,金属催化有机合成化学,中国科学技术大学
61,焦丽颖,女,博士,副教授,二维晶体化学与器件,清华大学
62,李剑锋,男,博士,教授,电化学拉曼光谱分析,厦门大学
63,钟羽武,男,博士,研究员,光功能金属有机化合物与光电化学,中国科学院化学研究所
64,程方益,男,博士,研究员,非整比电极材料化学,南开大学
65,匡华,女,博士,教授,基于手性纳米结构光学活性的细胞分析,江南大学
66,葛子义,男,博士,研究员,有机太阳能电池,中国科学院宁波材料技术与工程研究所
67,江智勇,男,博士,教授,新型不对称氢键催化,河南师范大学
68,徐维林,男,博士,研究员,单分子单粒子水平的能源化学过程基础研究,中国科学院长春应用化学研究所
69,袁荃,女,博士,教授,化学与生物传感,湖南大学
70,杜建忠,男,博士,教授,高分子囊泡,同济大学
71,刘波,男,博士,教授,天然产物全合成,四川大学
72,游雨蒙,男,博士,教授,分子压电材料,东南大学
73,伍志鲲,男,博士,研究员,结构化学,中国科学院合肥物质科学研究院
74,黄延强,男,博士,研究员,载人密闭空间二氧化碳转化及应用,中国科学院大连化学物理研究所
75,石峰,男,博士,研究员,多相催化,中国科学院兰州化学物理研究所
76,石伟群,男,博士,研究员,乏燃料后处理基础研究,中国科学院高能物理研究所
77,潘丙才,男,博士,教授,水污染控制化学,南京大学
78,杨宁,男,博士,研究员,多相反应器的介尺度模型及工程应用,中国科学院过程工程研究所
79,樊江莉,女,博士,教授,染料精细化工,大连理工大学
80,刘培念,男,博士,教授,表面合成化学,华东理工大学
81,李从刚,男,博士,研究员,核磁共振波谱学,中国科学院武汉物理与数学研究所
82,杨恒权,男,博士,教授,乳液界面催化,山西大学
83,蓝斐,男,博士,研究员,组蛋白甲基化的动态调控机制,复旦大学
84,蔡时青,男,博士,研究员,衰老的分子神经生物学机制研究,中国科学院上海生命科学研究院
85,于黎,女,博士,研究员,哺乳动物分子系统发育和适应性进化,云南大学
86,向烨,男,博士,研究员,分子生物物理,清华大学
87,秦国政,男,博士,研究员,园艺作物采后生物学,中国科学院植物研究所
88,沈晓骅,女,博士,副教授,细胞命运决定中非编码核酸介导的转录和染色质调控,清华大学
89,毕彦超,女,博士,教授,认知心理学与认知神经科学,北京师范大学
90,王晓伟,男,博士,教授,媒介昆虫传播植物病毒,浙江大学
91,晏向华,男,博士,教授,动物分子营养学,华中农业大学
92,王应祥,男,博士,研究员,植物生殖生物学,复旦大学
93,张龙,男,博士,教授,肿瘤细胞转移的内驱力与外泌体,浙江大学
94,巫永睿,男,博士,研究员,玉米胚乳发育与遗传改良,中国科学院上海生命科学研究院
95,姜长涛,男,博士,研究员,鞘脂神经酰胺与代谢性疾病,北京大学
96,储诚进,男,博士,教授,群落生态学,中山大学
97,杨力,男,博士,研究员,计算生物学,中国科学院上海生命科学研究院
98,杨辉,男,博士,研究员,基因编辑,中国科学院上海生命科学研究院
99,潘巍峻,男,博士,研究员,造血干细胞归巢与增殖微环境研究,中国科学院上海生命科学研究院
100,谌小维,男,博士,研究员,系统神经科学,中国人民解放军第三军医大学
101,徐强,男,博士,教授,柑橘基因组学与遗传改良,华中农业大学
102,于海鹏,男,博士,教授,林木生物质精炼,东北林业大学
103,谭安江,男,博士,研究员,昆虫生理生化,中国科学院上海生命科学研究院
104,谭明乾,男,博士,教授,食品营养组分包埋与递送机制,大连工业大学
105,曹鹏,男,博士,研究员,行为的神经生物学,北京生命科学研究所
106,陶小荣,男,博士,教授,植物病毒病害,南京农业大学
107,柳振峰,男,博士,研究员,膜蛋白结构生物学,中国科学院生物物理研究所
108,郭亚龙,男,博士,研究员,植物适应性进化,中国科学院植物研究所
109,孙飞,男,博士,研究员,生物电镜前沿技术,中国科学院生物物理研究所
110,朱作峰,男,博士,教授,水稻种质资源创新与优异基因挖掘,中国农业大学
111,程红,女,博士,研究员,RNA转运与降解的机制和功能,中国科学院上海生命科学研究院
112,杨琛,女,博士,研究员,微生物代谢流量调控,中国科学院上海生命科学研究院
113,赵建国,男,博士,研究员,猪功能基因组学和基因编辑,中国科学院动物研究所
114,崔宗强,男,博士,研究员,单病毒示踪,中国科学院武汉病毒研究所
115,姚红杰,男,博士,研究员,细胞命运决定的表观遗传机理,中国科学院广州生物医药与健康研究院
116,陈实,男,博士,教授,微生物表观遗传,武汉大学
117,刘颖,女,博士,研究员,细胞应激与稳态调控,北京大学
118,李毓龙,男,博士,研究员,神经生物学,北京大学
119,孔照胜,男,博士,研究员,细胞骨架与植物细胞形态建成,中国科学院微生物研究所
120,周志刚,男,博士,研究员,鱼类消化道微生物与宿主互作,中国农业科学院饲料研究所
121,程昊,男,博士,教授,变质岩年代学,同济大学
122,袁文平,男,博士,教授,陆地生态系统碳循环模型,中山大学
123,吴忠庆,男,博士,教授,矿物高温高压物性的第一性原理计算研究,中国科学技术大学
124,赵鹏军,男,博士,研究员,交通地理学,北京大学
125,袁志刚,男,博士,教授,内磁层-电离层耦合,武汉大学
126,吴怀春,男,博士,教授,古生代旋回地层学与天文年代学,中国地质大学（北京）
127,赵传峰,男,博士,教授,云物理学,北京师范大学
128,周顺桂,男,博士,教授,土壤生物电化学,福建农林大学
129,张立强,男,博士,教授,遥感图像/点云识别与理解,北京师范大学
130,李思亮,男,博士,教授,流域风化和地表过程,天津大学
131,袁增伟,男,博士,教授,资源流动及其环境效应,南京大学
132,王爱慧,女,博士,研究员,陆气相互作用和气候变化,中国科学院大气物理研究所
133,程晓,男,博士,教授,极地遥感,北京师范大学
134,唐朝生,男,博士,教授,极端气候工程地质,南京大学
135,汪名怀,男,博士,教授,气溶胶、云与气候相互作用,南京大学
136,史大林,男,博士,教授,海洋生物地球化学与全球变化,厦门大学
137,高彦征,男,博士,教授,土壤有机污染过程与控制,南京农业大学
138,王鑫,男,博士,研究员,物理海洋,中国科学院南海海洋研究所
139,黄迪颖,男,博士,研究员,中生代昆虫化石,中国科学院南京地质古生物研究所
140,王林,男,博士,研究员,东亚冬季风变异特征和机理,中国科学院大气物理研究所
141,田辉,男,博士,研究员,石油与天然气地球化学,中国科学院广州地球化学研究所
142,王力哲,男,博士,教授,遥感数据处理的理论与方法,中国地质大学（武汉）
143,王小萍,女,博士,研究员,持久性有机污染物区域循环,中国科学院青藏高原研究所
144,林霄沛,男,博士,教授,海洋环流动力学,中国海洋大学
145,付巧妹,女,博士,研究员,人类古基因组学,中国科学院古脊椎动物与古人类研究所
146,李正强,男,博士,研究员,大气气溶胶遥感和探测,中国科学院遥感与数字地球研究所
147,郑华,男,博士,研究员,生态系统服务,中国科学院生态环境研究中心
148,赵晓丽,女,博士,研究员,纳米污染物环境地球化学行为,中国环境科学研究院
149,李志伟,男,博士,教授,高精度InSAR三维形变测量,中南大学
150,陈晓清,男,博士,研究员,山地灾害形成机理与减灾,中国科学院、水利部成都山地灾害与环境研究所
151,谢桂青,男,博士,研究员,矿床学,中国地质科学院矿产资源研究所
152,黄汝锦,男,博士,研究员,有机气溶胶,中国科学院地球环境研究所
153,李峰,男,博士,教授,有机电致发光材料与器件,吉林大学
154,张广清,男,博士,教授,石油工程岩石力学,中国石油大学（北京）
155,龚政,男,博士,教授,海岸动力地貌学：多因子驱动下潮滩系统演变机制研究,河海大学
156,吴丁财,男,博士,教授,多孔高分子与炭材料,中山大学
157,赵宏伟,男,博士,教授,材料微观力学性能原位测试原理与技术,吉林大学
158,谢小荣,男,博士,教授,电力系统振荡的分析与控制,清华大学
159,李武华,男,博士,教授,新能源功率变换与运行调控,浙江大学
160,李建树,男,博士,教授,生物医用高分子材料,四川大学
161,罗坤,男,博士,教授,多相湍流燃烧,浙江大学
162,张弛,男,博士,教授,水资源系统分析及利用,大连理工大学
163,张艳锋,女,博士,研究员,二维碳基纳米材料及其异质结构,北京大学
164,王健君,男,博士,研究员,高分子材料表面与界面的研究,中国科学院化学研究所
165,孙卫玲,女,博士,副教授,水沙体系中复合污染迁移转化及生态效应,北京大学
166,王刚,男,博士,教授,非晶合金的断裂机理,上海大学
167,吴水林,男,博士,教授,医用金属材料表面改性与涂层,天津大学
168,汪怀远,男,博士,教授,极端环境下油气资源储存与输送,天津大学
169,余彦,女,博士,教授,钠离子电池,中国科学技术大学
170,王发洲,男,博士,教授,先进混凝土材料,武汉理工大学
171,张晨辉,男,博士,教授,液体超滑机理及应用研究,清华大学
172,鄢俊敏,女,博士,教授,氢燃料电池车用金属能源材料,吉林大学
173,崔宏志,男,博士,教授,储能混凝土,深圳大学
174,朱嘉,男,博士,教授,微结构光热转换材料与器件,南京大学
175,郭志光,男,博士,研究员,机械仿生表界面,中国科学院兰州化学物理研究所
176,傅继阳,男,博士,研究员,结构风工程,广州大学
177,杨上峰,男,博士,教授,富勒烯功能材料,中国科学技术大学
178,陈蓉,男,博士,教授,光流体能质传递及转化,重庆大学
179,黄永安,男,博士,教授,柔性电子制造技术与装备,华中科技大学
180,刘广义,男,博士,教授,浮选药剂,中南大学
181,陈益峰,男,博士,教授,岩土力学与岩土工程,武汉大学
182,丁彬,男,博士,研究员,高分子纳米纤维材料,东华大学
183,刘新华,男,博士,教授,金属控制凝固与控制成形短流程制备加工基础研究,北京科技大学
184,赵立东,男,博士,教授,热电材料,北京航空航天大学
185,张建,男,博士,教授,污水生物处理与资源化,山东大学
186,王志伟,男,博士,教授,污水处理与资源化,同济大学
187,温斌,男,博士,教授,材料力学行为的微观机制,燕山大学
188,吕友军,男,博士,教授,多相流热化学,西安交通大学
189,董必钦,男,博士,教授,滨海混凝土劣化与抑制,深圳大学
190,韩邦成,男,博士,教授,高速磁悬浮转子系统的优化、控制及应用,北京航空航天大学
191,訾斌,男,博士,教授,智能柔性驱动机器人理论、技术与装备,合肥工业大学
192,张瑜,男,博士,研究员,无机新能源材料,北京航空航天大学
193,刘攀,男,博士,教授,道路安全设计,东南大学
194,邵涛,男,博士,研究员,大气压脉冲气体放电等离子体,中国科学院电工研究所
195,李迎光,男,博士,教授,数字化制造与智能制造,南京航空航天大学
196,田华雨,男,博士,研究员,生物医用高分子材料,中国科学院长春应用化学研究所
197,戴庆,男,博士,研究员,碳基纳米光子学材料,国家纳米科学中心
198,刘锐平,男,博士,研究员,水中有毒无机物控制与资源化,中国科学院生态环境研究中心
199,沈俊,女,博士,研究员,磁制冷热力循环研究,中国科学院理化技术研究所
200,石峰,男,博士,教授,超分子材料,北京化工大学
201,张阿漫,男,博士,教授,水下爆炸与舰船毁伤,哈尔滨工程大学
202,蒋金洋,男,博士,研究员,海工混凝土超材料,东南大学
203,翟成,男,博士,教授,低透气性煤层致裂增透及瓦斯高效抽采,中国矿业大学
204,鲁军勇,男,博士,教授,舰载电磁发射技术,中国人民解放军海军工程大学
205,陈海生,男,博士,研究员,压缩空气储能关键科学问题研究,中国科学院工程热物理研究所
206,何旭辉,男,博士,教授,桥梁抗风与行车安全,中南大学
207,狄增峰,男,博士,研究员,集成电路用SOI材料,中国科学院上海微系统与信息技术研究所
208,黄辉,男,博士,教授,有机/高分子半导体材料,中国科学院大学
209,冯国瑞,男,博士,教授,遗留煤炭资源开采与灾害防控,太原理工大学
210,徐飞,男,博士,教授,光纤器件,南京大学
211,刘胜利,女,博士,教授,复杂网络环境下的公钥密码算法设计与证明,上海交通大学
212,杨军,男,博士,教授,光纤白光干涉测试,广东工业大学
213,陈云霁,男,博士,研究员,处理器体系结构,中国科学院计算技术研究所
214,李刚,男,博士,研究员,雷达运动目标成像与检测,清华大学
215,徐文渊,女,博士,教授,电子信息系统多要素安全分析与防护,浙江大学
216,李国良,男,博士,教授,数据库理论与系统,清华大学
217,刘云淮,男,博士,研究员,群智感知网络及应用研究,北京大学
218,潘纲,男,博士,教授,脑机混合智能,浙江大学
219,刘洋,男,博士,副教授,机器翻译,清华大学
220,迟楠,女,博士,教授,高频谱效率光调制与光传输,复旦大学
221,杨玉超,男,博士,研究员,面向类脑智能的忆阻神经形态器件,北京大学
222,张建华,女,博士,教授,无线信道的建模理论与实验研究,北京邮电大学
223,胡清华,男,博士,教授,不确定性人工智能,天津大学
224,陶晓明,女,博士,研究员,多媒体计算通信,清华大学
225,丁贵广,男,博士,副教授,多媒体检索与分析,清华大学
226,周鹏,男,博士,教授,新型存储与逻辑集成,复旦大学
227,彭宇新,男,博士,教授,跨媒体分析,北京大学
228,彭木根,男,博士,教授,无线通信协同组网理论与技术,北京邮电大学
229,龙世兵,男,博士,教授,宽禁带功率电子技术,中国科学技术大学
230,黄磊,男,博士,教授,鲁棒阵列信号处理,深圳大学
231,李明,男,博士,研究员,光子模拟信号处理,中国科学院半导体研究所
232,唐金辉,男,博士,教授,多媒体分析与检索,南京理工大学
233,谢晖,男,博士,教授,微纳机器人技术,哈尔滨工业大学
234,程鑫彬,男,博士,教授,强激光薄膜器件,同济大学
235,廖蕾,男,博士,教授,新型半导体异质集成及器件构筑,湖南大学
236,陆卫兵,男,博士,教授,电磁计算与应用,东南大学
237,王光臣,男,博士,教授,正倒向随机系统最优控制理论,山东大学
238,全伟,男,博士,教授,量子精密惯性测量与导航技术,北京航空航天大学
239,马帅,男,博士,教授,大数据近似计算,北京航空航天大学
240,贾晓军,男,博士,教授,量子信息网络与量子光学,山西大学
241,钟伟民,男,博士,教授,化工过程建模与运行优化,华东理工大学
242,张进成,男,博士,教授,宽禁带半导体电子器件,西安电子科技大学
243,陈海波,男,博士,教授,操作系统,上海交通大学
244,卢孝强,男,博士,研究员,光学遥感影像数据智能分析,中国科学院西安光学精密机械研究所
245,游经碧,男,博士,研究员,钙钛矿半导体光电器件,中国科学院半导体研究所
246,苏良碧,男,博士,研究员,激光晶体材料,中国科学院上海硅酸盐研究所
247,刘连庆,男,博士,研究员,微纳操控与类生命机器人,中国科学院沈阳自动化研究所
248,董海荣,女,博士,教授,复杂条件下列车运行智能控制与优化,北京交通大学
249,孙健,男,博士,教授,网络化火控系统分析与控制,北京理工大学
250,冷雨欣,男,博士,研究员,超强超短激光技术,中国科学院上海光学精密机械研究所
251,张龙,男,博士,研究员,红外光学材料,中国科学院上海光学精密机械研究所
252,林晓,男,博士,教授,二维原子晶体异质结构的外延生长及电学特性研究,中国科学院大学
253,周文慧,男,博士,教授,排队经济学与服务运营管理,华南理工大学
254,周欣悦,女,博士,教授,消费者情绪与行为决策,浙江大学
255,刘承芳,女,博士,副教授,农村教育管理与政策,北京大学
256,虞吉海,男,博士,教授,空间计量经济学,北京大学
257,龙建成,男,博士,教授,城市动态交通出行优化,合肥工业大学
258,吴力波,女,博士,教授,能源环境经济与政策分析,复旦大学
259,张影,男,博士,教授,消费者行为,北京大学
260,张新雨,男,博士,副研究员,计量经济理论与应用研究,中国科学院数学与系统科学研究院
261,方正,男,博士,教授,基于人工智能的市场营销,四川大学
262,廖华,男,博士,教授,能源经济与气候政策研究,北京理工大学
263,张健,男,博士,研究员,药物设计与先导化合物发现,上海交通大学
264,周宏伟,男,博士,教授,人体微生物组诊断方法学,南方医科大学
265,鲁伯埙,男,博士,研究员,神经变性病,复旦大学
266,黄永焯,男,博士,研究员,分子药剂学,中国科学院上海药物研究所
267,丁楅森,男,博士,教授,器官修复中血管重构,四川大学
268,李蓉,女,博士,教授,生殖内分泌紊乱调控子宫内膜容受性,北京大学
269,薛天,男,博士,教授,视觉神经系统的生物医学研究,中国科学技术大学
270,吕继成,男,博士,教授,IgA肾病发病机制及治疗研究,北京大学
271,朱永群,男,博士,教授,病原菌致病机制研究,浙江大学
272,陈良怡,男,博士,研究员,生物医学光学成像,北京大学
273,陈兰芬,女,博士,教授,Hippo信号通路调控免疫稳态与疾病,厦门大学
274,王金勇,男,博士,研究员,血液细胞再生与抗白血病研究,中国科学院广州生物医药与健康研究院
275,李斌,男,博士,教授,骨科生物材料与再生医学,苏州大学
276,李于,男,博士,研究员,肝脏营养感应与代谢调控,中国科学院上海生命科学研究院
277,艾玎,女,博士,教授,代谢性心血管疾病,天津医科大学
278,刘刚,男,博士,教授,分子影像探针,厦门大学
279,李卫,男,博士,研究员,男性不育致病机理,中国科学院动物研究所
280,缪小平,男,博士,教授,肿瘤分子流行病学,华中科技大学
281,郑宏庭,男,博士,主任医师,糖尿病并发症/合并症发病机理及干预策略,中国人民解放军第三军医大学
282,赵强,男,博士,教授,心血管生物材料,南开大学
283,徐金富,男,博士,教授,支气管扩张症与感染,同济大学
284,李磊,男,博士,主任医师,肿瘤治疗抵抗（泌尿系统肿瘤）,西安交通大学
285,高庆蕾,女,博士,教授,卵巢癌诊治新策略研究,华中科技大学
286,刘再毅,男,博士,主任医师,结直肠癌影像组学,广东省人民医院
287,孙逊,女,博士,教授,生物大分子药物递释系统,四川大学
288,高大明,男,博士,研究员,肿瘤细胞信号转导,中国科学院上海生命科学研究院
289,王强,男,博士,教授,母源环境与生殖健康,南京医科大学
290,戈惠明,男,博士,教授,天然药物化学,南京大学
291,张杰,男,博士,教授,阿尔茨海默病的致病机制研究,厦门大学
292,李涛,男,博士,研究员,天然免疫,中国人民解放军军事科学院军事医学研究院
293,唐亚梅,女,博士,教授,放射医学（放射性神经损伤的机制和治疗）,中山大学
294,明东,男,博士,教授,神经工程,天津大学
295,秦成峰,男,博士,研究员,虫媒黄病毒感染与致病机制研究,中国人民解放军军事科学院军事医学研究院
296,周洁,女,博士,教授,粘膜免疫与疾病,天津医科大学
297,林灼锋,男,博士,研究员,脂肪细胞因子与心血管疾病,温州医科大学
298,高昊,男,博士,教授,中药药效物质,暨南大学
299,朱波,男,博士,教授,肿瘤免疫调控的细胞与分子机制,中国人民解放军第三军医大学
300,张晨,男,博士,教授,神经生物学,首都医科大学
